{
  "slug": "burst-balloons",
  "number": 312,
  "category": "Algorithms",
  "patterns": [
    "dp-interval"
  ],
  "hints": [
    {
      "level": 1,
      "title": "The Forward Trap vs Reverse Insight",
      "text": "If you pick which balloon to burst FIRST in range [i, j], the remaining balloons on the left and right now become adjacent to each other! Their future coins depend on what happens on the other side. This destroys subproblem independence! What if we invert time and pick which balloon is burst LAST?"
    },
    {
      "level": 2,
      "title": "The Independence Invariant",
      "text": "If balloon k is burst LAST in range (i, j), then during the entire process of bursting other balloons in (i, k) and (k, j), balloon k, balloon i, and balloon j remain unburst! That means the subproblems (i, k) and (k, j) are completely independent!"
    },
    {
      "level": 3,
      "title": "Recurrence Relation",
      "text": "Pad array with 1 at both ends: nums = [1] + nums + [1]. dp[i][j] = max coins from bursting all balloons strictly BETWEEN i and j. dp[i][j] = max_{k=i+1}^{j-1} (dp[i][k] + dp[k][j] + nums[i] * nums[k] * nums[j])."
    },
    {
      "level": 4,
      "title": "Code Skeleton",
      "text": "```python\nnums = [1] + nums + [1]\nn = len(nums)\ndp = [[0] * n for _ in range(n)]\n\nfor length in range(2, n): # window size\n    for left in range(0, n - length):\n        right = left + length\n        for k in range(left + 1, right):\n            coins = dp[left][k] + dp[k][right] + nums[left] * nums[k] * nums[right]\n            dp[left][right] = max(dp[left][right], coins)\n\nreturn dp[0][n - 1]\n```"
    }
  ],
  "complexity": {
    "kind": "big-o",
    "time": "O(N^3)",
    "space": "O(N^2)",
    "variables": [
      "N: number of balloons (N <= 300)"
    ],
    "notes": "Interval DP iterating over all sub-ranges and last popped balloon k."
  },
  "solutions": [
    {
      "lang": "python3",
      "code": "class Solution:\n    def maxCoins(self, nums: list[int]) -> int:\n        nums = [1] + [x for x in nums if x > 0] + [1]\n        n = len(nums)\n        dp = [[0] * n for _ in range(n)]\n\n        for length in range(2, n):\n            for left in range(n - length):\n                right = left + length\n                for k in range(left + 1, right):\n                    coins = dp[left][k] + dp[k][right] + nums[left] * nums[k] * nums[right]\n                    if coins > dp[left][right]:\n                        dp[left][right] = coins\n\n        return dp[0][n - 1]",
      "approach": "Reverse Order Thinking (Choose LAST burst balloon in interval)",
      "verifiedBy": "leetcode",
      "testedOn": "LeetCode"
    }
  ],
  "review": {
    "status": "draft",
    "acceptedOnLeetCode": null,
    "reviewer": null
  },
  "updated": "2026-10-17T00:00:00.000Z"
}
