{
  "slug": "daily-temperatures",
  "number": 739,
  "category": "Algorithms",
  "patterns": [
    "stack-monotonic-next-greater"
  ],
  "hints": [
    {
      "level": 1,
      "title": "Recognizing Monotonic Stack",
      "text": "Any question asking 'for each element, find the first element to its right that is greater/smaller' is solvable in O(N) using a Monotonic Stack."
    },
    {
      "level": 2,
      "title": "Stack Invariant",
      "text": "Maintain a stack of indices with decreasing temperatures. When a warmer day arrives, it acts as the 'next warmer day' for everything smaller currently on top of the stack!"
    },
    {
      "level": 3,
      "title": "Index Distance",
      "text": "Pop the index prev_i. The waiting days is simply i - prev_i. Put answer[prev_i] = i - prev_i."
    },
    {
      "level": 4,
      "title": "Code Skeleton",
      "text": "```python\nn = len(temperatures)\nres = [0] * n\nstack = [] # stores indices\n\nfor i, temp in enumerate(temperatures):\n    while stack and temp > temperatures[stack[-1]]:\n        prev = stack.pop()\n        res[prev] = i - prev\n    stack.append(i)\n\nreturn res\n```"
    }
  ],
  "complexity": {
    "kind": "big-o",
    "time": "O(N)",
    "space": "O(N)",
    "variables": [
      "N: length of temperatures array (N <= 10^5)"
    ],
    "notes": "Monotonic decreasing stack where each index is pushed and popped at most once."
  },
  "solutions": [
    {
      "lang": "python3",
      "code": "class Solution:\n    def dailyTemperatures(self, temperatures: list[int]) -> list[int]:\n        n = len(temperatures)\n        res = [0] * n\n        stack = []\n\n        for i, t in enumerate(temperatures):\n            while stack and t > temperatures[stack[-1]]:\n                prev_idx = stack.pop()\n                res[prev_idx] = i - prev_idx\n            stack.append(i)\n\n        return res",
      "approach": "Index Distance instead of Value (Monotonic Decreasing Stack)",
      "verifiedBy": "leetcode",
      "testedOn": "LeetCode"
    }
  ],
  "review": {
    "status": "draft",
    "acceptedOnLeetCode": null,
    "reviewer": null
  },
  "updated": "2026-10-17T00:00:00.000Z"
}
